country,date_posted,title,url,bdesc,crawl_time
India,2 hours ago,Looking for cloves urgently,https://www.tradewheel.com/buyers/looking-for-cloves-urgently/870125/,"We are looking to purchase 4,000 kg of cloves. Suppliers with good quality stock and competitive offers are invited to provide their quotations.",2025-09-03 09:39:40
Canada,14 hours ago,Need of lentils,https://www.tradewheel.com/buyers/need-of-lentils/869977/,"i am looks for Lentils and Oat Flake - Green Lentils Spec Laird #1 or #2 100,000 kgs per month - I do not need shrimp at this moment.",2025-09-03 09:39:40
Belgium,14 hours ago,Looking for Bitumen,https://www.tradewheel.com/buyers/looking-for-bitumen/869969/,Send Price of Bitumen Solid 50/70 Bitumen Solid 70/100,2025-09-03 09:39:40
Morocco,14 hours ago,Planning To Buy Elevators,https://www.tradewheel.com/buyers/planning-to-buy-elevators/869956/,"Greetings, We are looking to purchase elevators. Please provide technical specifications, capacity details and available models.",2025-09-03 09:39:40
Norway,14 hours ago,Immediate Purchase Of Gaming Monitors,https://www.tradewheel.com/buyers/immediate-purchase-of-gaming-monitors/869953/,"Good day, We are looking to purchase gaming monitors. Please provide us with detailed specifications along with pricing. Thank you.",2025-09-03 09:39:40
Tanzania,14 hours ago,In Search Of Baby Toys,https://www.tradewheel.com/buyers/in-search-of-baby-toys/869948/,"Hi there, We are looking to purchase baby toys. The toys should be designed for safety, creativity and durability. Kind Regards.",2025-09-03 09:39:40
Netherlands,14 hours ago,Planning to buy vapes,https://www.tradewheel.com/buyers/planning-to-buy-vapes/869944/,"Hello, We are currently sourcing vapes. Please provide detailed specifications, available models and customization options.",2025-09-03 09:39:40
Spain,14 hours ago,In Search Of Candle Holders,https://www.tradewheel.com/buyers/in-search-of-candle-holders/869943/,"Hi there, We are looking to buy candle holders. The products should be available in glass, metal, ceramic or wood designs.",2025-09-03 09:39:40
Malaysia,14 hours ago,In Search Of Vegetable Oil,https://www.tradewheel.com/buyers/in-search-of-vegetable-oil/869939/,"Hello, We are seeking premium quality vegetable oil in bulk. The oil should be suitable for cooking and food processing industries. Kind Regards.",2025-09-03 09:39:40
USA,15 hours ago,Buying AC motors for machinery and equipment supply.,https://www.tradewheel.com/buyers/buying-ac-motors-for-machinery-and-equipment-supply/869933/,"We are sourcing AC motors for industrial applications with stable performance and efficiency. Voltage compatibility, power range, and durability are important factors. Suppliers offering bulk quantities can share their product details.",2025-09-03 09:39:40
Germany,15 hours ago,Procuring solid wood boards for furniture and construction.,https://www.tradewheel.com/buyers/procuring-solid-wood-boards-for-furniture-and-construction/869932/,"I am reviewing suppliers of solid wood boards for construction and furniture purposes. Wood quality, thickness range, and smooth finishing are essential concerns. Please share details on available types and supply capacity.",2025-09-03 09:39:40
Germany,15 hours ago,Buying Martial Arts Wears in different sizes.,https://www.tradewheel.com/buyers/buying-martial-arts-wears-in-different-sizes/869931/,"We are open to offers for martial arts wear in different sizes and styles. Fabric strength, stitching quality, and comfortable fitting are important for our purchase. Kindly provide available designs and packaging details.",2025-09-03 09:39:40
Republic of Türkiye,15 hours ago,Buying car amplifiers for retail and distribution.,https://www.tradewheel.com/buyers/buying-car-amplifiers-for-retail-and-distribution/869930/,"Our current requirement includes car amplifiers with strong sound output and compact designs. Product durability, wattage range, and installation ease are key aspects. Please provide product details and pricing for different models.",2025-09-03 09:39:40
USA,15 hours ago,Procuring high pressure cleaners for cleaning equipment supply.,https://www.tradewheel.com/buyers/procuring-high-pressure-cleaners-for-cleaning-equipment-supply/869929/,I am open to quotations for high pressure cleaners suitable for industrial cleaning. Please include flow rate and motor details.,2025-09-03 09:39:40
Pakistan,15 hours ago,Sourcing waiting chairs for wholesale and resale.,https://www.tradewheel.com/buyers/sourcing-waiting-chairs-for-wholesale-and-resale/869928/,"We require waiting chairs for commercial and office setups in durable designs. Comfort, weight capacity, and material quality are priorities in selection. Suppliers with bulk supply capability can share their catalog.",2025-09-03 09:39:40
Kenya,15 hours ago,Sourcing milk powder for food supply and distribution.,https://www.tradewheel.com/buyers/sourcing-milk-powder-for-food-supply-and-distribution/869926/,"We are sourcing milk powder in bulk quantities for both food processing and retail packaging purposes. Quality standards, fat content, and shelf life are key concerns. Suppliers with reliable export capacity are welcome to share offers.",2025-09-03 09:39:40
Ecuador,15 hours ago,Buying Aokai ANR200 24V motor starters for machinery use.,https://www.tradewheel.com/buyers/buying-aokai-anr200-24v-motor-starters-for-machinery/869925/,"I am interested in the Aokai ANR200 24V Motor Starter for automotive applications. Consistency in performance, durability, and compatibility with common systems are important factors. Kindly provide technical details and available supply options.",2025-09-03 09:39:40
USA,15 hours ago,Urgent Requirement Of Furniture Hinges,https://www.tradewheel.com/buyers/urgent-requirement-of-furniture-hinges/869924/,"Hello, We are looking to purchase furniture hinges. The hinges must be durable, rust-resistant and available in multiple sizes. Kind Regards.",2025-09-03 09:39:40
India,15 hours ago,In Search Of AC Motors,https://www.tradewheel.com/buyers/in-search-of-ac-motors/869922/,"Good day, We are currently seeking AC motors. The motors must be reliable, energy-efficient and compliant with international standards.",2025-09-03 09:39:40
United Kingdom,15 hours ago,Procuring Truck body parts for workshop and maintenance needs.,https://www.tradewheel.com/buyers/procuring-truck-body-parts-for-workshop-and-maintenance/869921/,"I am open to quotations for truck body parts including panels, bumpers, and fittings. Kindly share durability specs and lead time.",2025-09-03 09:39:40
Pakistan,15 hours ago,Need clock Parts and accessories for retail and wholesale business.,https://www.tradewheel.com/buyers/need-clock-parts-and-accessories-for-retail-and/869920/,"We are trying to identify exporters of clock parts and accessories in various designs and materials. Precision quality, durability, and compatibility with different clock models will be preferred. Please share your catalog and pricing.",2025-09-03 09:39:40
Canada,15 hours ago,"Sourcing HDPE, LDPE, LLDPE raw material for manufacturing.",https://www.tradewheel.com/buyers/sourcing-hdpe-ldpe-lldpe-raw-material-for-manufacturing/869919/,"We have interest in long-term supply of HDPE, LDPE, and LLDPE resins for industrial applications. Clarity, strength, and recyclability are factors we need to evaluate. Please share availability in different grades and packaging formats.",2025-09-03 09:39:40
India,15 hours ago,Need cashew shell supply for export and resale.,https://www.tradewheel.com/buyers/need-cashew-shell-supply-for-export-and-resale/869918/,"Our purchasing team needs details on cashew shells suitable for oil extraction and related uses. Dryness level, processing method, and bulk packing options are important to review. Kindly provide supply terms.",2025-09-03 09:39:40
Netherlands,15 hours ago,Buying Black Cumin in bulk for trade supply.,https://www.tradewheel.com/buyers/buying-black-cumin-in-bulk-for-trade-supply/869917/,"I’m reviewing supplier portfolios for Nigella sativa seeds (black cumin) used for distribution purpose. Cleanliness, moisture content, and origin certification are important concerns. Kindly provide product information and MOQ.",2025-09-03 09:39:40
Ecuador,15 hours ago,Need Coil Forming Machines,https://www.tradewheel.com/buyers/need-coil-forming-machines/869915/,"Hello, We are sourcing advanced coil forming machines. The machines must be durable, efficient & capable of handling heavy-duty operations.",2025-09-03 09:39:40
USA,15 hours ago,Importing Natural Honey for food and retail business.,https://www.tradewheel.com/buyers/importing-natural-honey-for-food-and-retail-business/869914/,We are checking specifications for natural honey with high purity levels and good shelf stability. Packaging in glass jars or bulk drums is of interest for our market. Exporters with consistent quality are welcome to share details.,2025-09-03 09:39:40
Germany,15 hours ago,Procuring Refined sunflower oil and edible oils for cooking use.,https://www.tradewheel.com/buyers/procuring-refined-sunflower-oil-and-edible-oils-for/869913/,"We are inquiring about edible oils including refined sunflower oil and vegetable oil suitable for bulk purchase. Purity standards, packaging types (bottles or drums), and shelf life information are required. Please share certifications and pricing.",2025-09-03 09:39:40
Brazil,15 hours ago,Buying Home decor products for retail supply.,https://www.tradewheel.com/buyers/buying-home-decor-products-for-retail-supply/869912/,"Our procurement plan includes sourcing a range of home décor items in modern and traditional designs. Material quality, finishing, and unique styles will play an important role. Suppliers offering mixed product options are preferred.",2025-09-03 09:39:40
Netherlands,15 hours ago,Importing Stickers for promotional and decorative purposes.,https://www.tradewheel.com/buyers/importing-stickers-for-promotional-and-decorative-purposes/869911/,"I am open to quotations for various types of stickers, including waterproof and heat-resistant options. Printing quality, adhesive strength, and available sizes matter for our requirement. Kindly provide samples and catalog details.",2025-09-03 09:39:40
Indonesia,15 hours ago,Immediate Purchase Of Peanut Sauce,https://www.tradewheel.com/buyers/immediate-purchase-of-peanut-sauce/869909/,"Good day, We are looking for premium-quality peanut sauce. The product must be hygienically packed, flavorful, and certified for food safety.",2025-09-03 09:39:40
Pakistan,15 hours ago,Need Air Handling Units,https://www.tradewheel.com/buyers/need-air-handling-units/869907/,"We are currently in search of high-quality air handling units. The equipment must be energy-efficient, durable and compliant with international standards.",2025-09-03 09:39:40
Germany,15 hours ago,Sourcing shea butter & honey body lotion for skincare range.,https://www.tradewheel.com/buyers/sourcing-shea-butter-honey-body-lotion-for/869906/,"I want to see samples of Shea Butter & Honey Body Lotion with smooth texture and natural ingredients. Product quality, skin compatibility, and attractive packaging will be important for selection. Kindly update on available sizes.",2025-09-03 09:39:40
India,15 hours ago,In Search Of Construction Materials,https://www.tradewheel.com/buyers/in-search-of-construction-materials/869905/,"Good day, We are interested in buying construction materials. Kindly send us your product list with specifications and certifications. Thank you.",2025-09-03 09:39:40
Pakistan,15 hours ago,Need silicone dispensing bottles,https://www.tradewheel.com/buyers/need-silicone-dispensing-bottles/869902/,"Hello, We are looking for pure silicone dispensing bottles. The bottles must be safe, eco-friendly and suitable for liquids. Thank you.",2025-09-03 09:39:40
Madagascar,15 hours ago,Need laser beauty equipment,https://www.tradewheel.com/buyers/need-laser-beauty-equipment/869901/,"Good day, We are interested in buying laser beauty equipment. Kindly share information on after-sales service, spare parts availability & delivery timelines.",2025-09-03 09:39:40
USA,15 hours ago,Procuring Valve Assy Kit-Control 3170E-29X9C for machinery replacement.,https://www.tradewheel.com/buyers/procuring-valve-assy-kit-control-3170e-29x9c-for-machinery-replacement/869899/,"We are inquiring about available stock for VALVE ASSY KIT-CONTROL 3170E-29X9C, suitable for industrial machinery use. Product compatibility, durability, and prompt delivery options are key considerations for us. Kindly provide technical details and s...",2025-09-03 09:39:40
Spain,15 hours ago,Need Eyelash Care Products to add in cosmetic range,https://www.tradewheel.com/buyers/need-eyelash-care-products-to-add-in-cosmetic/869898/,We have interest in long-term supply of eyelash care products and serums for cosmetic distribution. Packaging variations and branding possibilities are key points. Delivery to Spain.,2025-09-03 09:39:40
USA,15 hours ago,Need Used Cars for retail resale business.,https://www.tradewheel.com/buyers/need-used-cars-for-retail-resale-business/869897/,"I am open to quotations for used cars in good running condition with proper maintenance history. Different models and engine capacities can be considered, but reliability and fair mileage are essential factors for us. Please share available options a...",2025-09-03 09:39:40
Czech Republic,15 hours ago,In search of men's wear,https://www.tradewheel.com/buyers/in-search-of-mens-wear/869896/,"Good day, We are looking to purchase men's wear. The collection should include shirts, trousers, jackets and casual wear. Kind Regards.",2025-09-03 09:39:40
Nigeria,15 hours ago,Quotation For Charcoal,https://www.tradewheel.com/buyers/quotation-for-charcoal/869895/,Hi we are looking for Charcoal in Nigeria we need about 100MT Please share your good good price with us Thank you,2025-09-03 09:39:40
Taiwan,15 hours ago,Need Speaker and AirPods for retail sales and customer demand.,https://www.tradewheel.com/buyers/need-speaker-and-airpods-for-retail-sales-and/869894/,"I am open to quotations for speaker and airpods suitable for both personal and retail supply. Clear sound quality, durable material, and stable wireless connection are important for us. Please share available models with specs and pricing for bulk pu...",2025-09-03 09:39:40
China,15 hours ago,Need Building Material for upcoming construction projects,https://www.tradewheel.com/buyers/need-building-material-for-upcoming-construction-projects/869893/,"We are inquiring about available stock for building material required for upcoming projects. Quality and strength are our top priorities, and we may need options in both cement-based and metal-based materials. Kindly share specifications, grades, and...",2025-09-03 09:39:40
Mongolia,15 hours ago,Need furniture legs for assembling tables and chairs.,https://www.tradewheel.com/buyers/need-furniture-legs-for-assembling-tables-and-chairs/869891/,"Hi all. I am sourcing furniture legs made of strong and durable material such as steel or solid wood. The design should be stable, with smooth finishing and available in different sizes to fit tables, chairs, and cabinets. Please share product detail...",2025-09-03 09:39:40
USA,15 hours ago,Procuring drones with related parts for general commercial use.,https://www.tradewheel.com/buyers/procuring-drones-with-related-parts-for-general-commercial/869890/,"I am looking for drones and their compatible accessories suitable for both personal and industrial applications. The models should have stable flight performance, good camera resolution, and durable battery life. Accessories like extra propellers, ca...",2025-09-03 09:39:40
Indonesia,15 hours ago,Immediate Purchase Of Canned Mackerel,https://www.tradewheel.com/buyers/immediate-purchase-of-canned-mackerel/869882/,"Hello, We are sourcing canned mackerel for distribution. The products must be of premium quality, with reliable shelf life and packaging.",2025-09-03 09:39:40
Sweden,15 hours ago,Buying Pet Furniture for Retail Supply and Customer Demand,https://www.tradewheel.com/buyers/buying-pet-furniture-for-retail-supply-and-customer/869881/,We are checking catalogues for indoor and outdoor pet furniture. Kindly confirm material safety and MOQ.,2025-09-03 09:39:40
Iran,15 hours ago,Need IndustriaI Roller Chains,https://www.tradewheel.com/buyers/need-industriai-roller-chains/869880/,"Good day, We are interested in buying industrial roller chains. The chains must be durable, corrosion-resistant, and suitable for heavy loads.",2025-09-03 09:39:40
India,15 hours ago,Procuring Medical Gauze in Bulk for Pharmacy Distribution,https://www.tradewheel.com/buyers/procuring-medical-gauze-in-bulk-for-pharmacy-distribution/869879/,We are evaluating medical gauze suppliers for long-term supply. Share minimum order quantities and shipping terms.,2025-09-03 09:39:40
Italy,15 hours ago,Sourcing Dental Cotton Rolls for Clinic and Medical Use,https://www.tradewheel.com/buyers/sourcing-dental-cotton-rolls-for-clinic-and-medical/869878/,Our clinic network is reviewing suppliers for dental-grade cotton rolls. Share pricing for bulk cartons and delivery times. Only reliable suppliers can contact me through whatsapp/email.,2025-09-03 09:39:40
Mauritius,15 hours ago,RFQ for high-quality Activated Carbon,https://www.tradewheel.com/buyers/rfq-for-high-quality-activated-carbon/869877/,"We are a trading company based in Mauritius, actively sourcing high-quality Activated Carbon for immediate and long-term supply. Specifications: Type: Activated Carbon (Coconut Shell preferred, but open to other types) Size: 1–3 mm (can consider o...",2025-09-03 09:39:40
Zambia,15 hours ago,Inquiring For Tantalite,https://www.tradewheel.com/buyers/inquiring-for-tantalite/869876/,Hi we are looking for Tantalite in Zambia We need Atleast 2 tonnes. Please share your product details with us thank you,2025-09-03 09:39:40
USA,15 hours ago,Sourcing lithium ion batteries,https://www.tradewheel.com/buyers/sourcing-lithium-ion-batteries/869875/,"Good day, We would like to procure lithium ion batteries. The products must ensure long lifespan and excellent charging efficiency. Kind Regards.",2025-09-03 09:39:40
Philippines,16 hours ago,Buying Smoke and Emission Meters for Vehicle Testing Purposes,https://www.tradewheel.com/buyers/buying-smoke-and-emission-meters-for-vehicle-testing/869873/,"Hello dear, I am sourcing smoke and emission meters for automotive testing applications. Kindly confirm calibration standards and accuracy levels.",2025-09-03 09:39:40
Nepal,16 hours ago,Need Alkaline Water Ionizers,https://www.tradewheel.com/buyers/need-alkaline-water-ionizers/869872/,"Greetings, We are interested in buying alkaline water ionizers. The products should ensure safe filtration along with user-friendly operation. Kind Regards.",2025-09-03 09:39:40
Thailand,16 hours ago,Require Industrial Dehydrator Machines,https://www.tradewheel.com/buyers/require-industrial-dehydrator-machines/869869/,"Hello, We would like to purchase industrial dehydrator machines. Kindly share information on available models, energy consumption rates and material quality.",2025-09-03 09:39:40
Egypt,16 hours ago,Sourcing Activated Carbon for Water and Air Purification Use,https://www.tradewheel.com/buyers/sourcing-activated-carbon-for-water-and-air-purification/869867/,I am open to quotations for activated carbon used in water and air purification. Kindly specify iodine value and pore size details. Delivery to Egypt.,2025-09-03 09:39:40
Indonesia,16 hours ago,Need Green Abrasive Discs,https://www.tradewheel.com/buyers/need-green-abrasive-discs/869866/,"Good day, We would like to buy green abrasive discs. The discs must offer high durability, fast cutting, and smooth finishing. Thank you.",2025-09-03 09:39:40
Philippines,16 hours ago,Need Durable Air Shock Absorbers for Vehicle Replacement Parts,https://www.tradewheel.com/buyers/need-durable-air-shock-absorbers-for-vehicle-replacement/869865/,I am open to quotations for air shock absorbers specially designed for Harley-Davidson bikes. Confirm fitment models and adjustment options.,2025-09-03 09:39:40
India,16 hours ago,Procuring Lithium Batteries for Energy Storage Applications,https://www.tradewheel.com/buyers/procuring-lithium-batteries-for-energy-storage-applications/869864/,We have interest in long-term supply of EV-grade lithium ion batteries. Please update me on capacity options and sample availability.,2025-09-03 09:39:40
India,16 hours ago,Sourcing Lift Parts for Maintenance and Repair Needs,https://www.tradewheel.com/buyers/sourcing-lift-parts-for-maintenance-and-repair-needs/869863/,We require immediate shipment options for lift door parts and cables. Please update on current stock and nearest port delivery time. Delivery to India.,2025-09-03 09:39:40
Cameroon,16 hours ago,Buying Stainless Steel Mesh Sheets for Construction and Protection Use,https://www.tradewheel.com/buyers/buying-stainless-steel-mesh-sheets-for-construction-and/869862/,I’m reviewing supplier portfolios for stainless steel mesh sheets. Looking at durability standards and certifications before moving forward.,2025-09-03 09:39:40
India,16 hours ago,Bulk Order For Food Grade PP Woven Bags,https://www.tradewheel.com/buyers/bulk-order-for-food-grade-pp-woven-bags/869861/,"Dear Sir, I am looking to purchase food grade PP woven bags. The products must be strong, eco-friendly and meet international standards.",2025-09-03 09:39:40
Australia,16 hours ago,In search of optical transceivers,https://www.tradewheel.com/buyers/in-search-of-optical-transceivers/869857/,"Good day, We are currently sourcing optical transceivers. Please provide us with technical details such as speed, distance and wavelength. Kind Regards.",2025-09-03 09:39:40
Algeria,16 hours ago,In Search Of AOC Cables,https://www.tradewheel.com/buyers/in-search-of-aoc-cables/869855/,"Hello, We would like to purchase AOC cables. The cables must support high-speed data transmission with excellent durability. Thank you.",2025-09-03 09:39:40
Russia,16 hours ago,Buying Hydraulic Hose in Bulk for Replacement and Repair Needs,https://www.tradewheel.com/buyers/buying-hydraulic-hose-in-bulk-for-replacement-and/869854/,"I’m reviewing supplier portfolios for hydraulic hoses that meet high-pressure standards. Inform me about burst pressure, fitting types, and stock availability.",2025-09-03 09:39:40
India,16 hours ago,Buying Electroplating Rectifiers for Metal Finishing Applications,https://www.tradewheel.com/buyers/buying-electroplating-rectifiers-for-metal-finishing-applications/869853/,"We have interest in long-term supply of DC electroplating rectifiers. Please update me on standard models, output range, and after-sales service.",2025-09-03 09:39:40
Peru,16 hours ago,Buying Membrane Switches for Industrial and Commercial Projects,https://www.tradewheel.com/buyers/buying-membrane-switches-for-industrial-and-commercial-projects/869850/,I am checking specifications for membrane switches with durable tactile response. Kindly provide info on printing options and lifespan cycles.,2025-09-03 09:39:40
Russia,16 hours ago,Need POF Shrink Film for Wrapping and Product Protection,https://www.tradewheel.com/buyers/need-pof-shrink-film-for-wrapping-and-product/869849/,Our purchasing team needs details on POF shrink film rolls in different thicknesses for packaging applications. Share MOQ and delivery options.,2025-09-03 09:39:40
Pakistan,16 hours ago,Procuring Laser Cutting Machines for Manufacturing Projects,https://www.tradewheel.com/buyers/procuring-laser-cutting-machines-for-manufacturing-projects/869848/,I am open to quotations for laser cutting machines that can handle both thin and thick sheet metals. Please confirm available power ranges and warranty terms.,2025-09-03 09:39:40
India,16 hours ago,Procuring Mini Car Fridges for Travel and Portable Use,https://www.tradewheel.com/buyers/procuring-mini-car-fridges-for-travel-and-portable/869846/,"I’m sourcing portable mini car fridges in compact capacities (around 6–12L). Please confirm cooling performance, voltage requirement, and available designs. Interested in export-ready stock options.",2025-09-03 09:39:40
India,16 hours ago,Need Roll Forming Machinery for Factory and Industrial Supply,https://www.tradewheel.com/buyers/need-roll-forming-machinery-for-factory-and-industrial/869845/,Our company is seeking roll forming machines suitable for industrial sheet work. Kindly share technical specifications like forming width and automation options. Production lead times and installation support would also be useful.,2025-09-03 09:39:40
Bangladesh,16 hours ago,Procuring Foldable Metal Desks in Bulk for Furniture Market,https://www.tradewheel.com/buyers/procuring-foldable-metal-desks-in-bulk-for-furniture/869844/,"We have a requirement for foldable metal desks that are easy to carry and store. Share details of sizes, load capacity, and finishing options. Also mention minimum order requirements.",2025-09-03 09:39:40
Pakistan,16 hours ago,Buying Refillable Perfume Bottles in Different Sizes for Distribution,https://www.tradewheel.com/buyers/buying-refillable-perfume-bottles-in-different-sizes-for/869843/,"I want to connect with suppliers of refillable perfume bottles used for cosmetic packaging. Please advise on material choices like glass or PET, spray quality, and available designs. Custom branding options are also of interest.",2025-09-03 09:39:40
