country,date_posted,title,url,bdesc,crawl_time
India,16 hours ago,Buying Inflatable Durable Safe Boat Boat for Outdoor and Water Use,https://www.tradewheel.com/buyers/buying-inflatable-durable-safe-boat-boat-for-outdoor/869842/,"Hi all. This is Naba Kumar from India, and I am searching for Inflatable Motor Dinghies (Durable Safe Boats) as well as Fiber & Plastic Boats. I would like to know the available sizes, safety features, and durability specifications. Please also share...",2025-09-03 09:39:40
United Kingdom,16 hours ago,Need Energy Storage System for Renewable Power Projects,https://www.tradewheel.com/buyers/need-energy-storage-system-for-renewable-power-projects/869838/,"We are planning to procure energy storage systems for long-term use. Please share battery type (Li-ion / other), storage capacity, and installation options. Confirm shipping time for bulk supply.",2025-09-03 09:39:40
South Africa,16 hours ago,Buying 4 Layer PCB Boards for Assembly and Circuit Use,https://www.tradewheel.com/buyers/buying-4-layer-pcb-boards-for-assembly-and/869837/,"We require 4-layer printed circuit boards for electronics assembly. Provide details on thickness, copper weight, and surface finish. Also confirm production capacity and delivery schedules.",2025-09-03 09:39:40
Indonesia,16 hours ago,Procuring Heavy-Duty Walkie Talkie Sets for Workplace Use,https://www.tradewheel.com/buyers/procuring-heavy-duty-walkie-talkie-sets-for-workplace-use/869836/,"My name is Adit and I am searching for reliable suppliers of industrial walkie talkies. Please provide details on range, battery backup, and durability. Share lead times for export orders.",2025-09-03 09:39:40
United Arab Emirates,16 hours ago,Sourcing High-Quality Trolley Bags for Luggage Distribution,https://www.tradewheel.com/buyers/sourcing-high-quality-trolley-bags-for-luggage-distribution/869835/,We need different types of bags including school bags and trolley bags. Share available materials like polyester or leather and color options. Kindly confirm your MOQ.,2025-09-03 09:39:40
Thailand,16 hours ago,Need Debricking Machine for Construction and Demolition Work,https://www.tradewheel.com/buyers/need-debricking-machine-for-construction-and-demolition-work/869834/,We are looking to source construction machines such as debricking machines for heavy-duty use. Please share technical specs and power capacity. Also confirm delivery timelines for bulk orders.,2025-09-03 09:39:40
Republic of Türkiye,16 hours ago,Looking For Drained Battery,https://www.tradewheel.com/buyers/looking-for-drained-battery/869833/,Hi we are looking for Drained Battery/ Battery Scrap in Turkey we would like to know the price for 10Tons Please share your good price Thank you,2025-09-03 09:39:40
Macedonia,19 hours ago,Quotation For Tissue Papers,https://www.tradewheel.com/buyers/quotation-for-tissue-papers/869801/,Hi we are looking for Tissue Papers we need about 40hc container load Kindly share your good prices with us Thank you,2025-09-03 09:39:40
Hong Kong,19 hours ago,Immediate Purchase Of Raincoats,https://www.tradewheel.com/buyers/immediate-purchase-of-raincoats/869790/,"Dear Sir, I am interested in buying raincoats. The raincoats must ensure full protection, comfort and long-lasting wear. Thank you.",2025-09-03 09:39:40
Argentina,19 hours ago,Immediate Purchase Of Microfiber Cloth,https://www.tradewheel.com/buyers/immediate-purchase-of-microfiber-cloth/869786/,"Good day, I am interested in buying microfiber cloths. Kindly provide details on available designs and packaging options. Thank you.",2025-09-03 09:39:40
France,19 hours ago,Looking for Hazel Nut,https://www.tradewheel.com/buyers/looking-for-hazel-nut/869785/,Hello i am looking for 500kg to test quality and after 20t Hazelnuts. My delivery location is France. Kindly let me know about the prices.,2025-09-03 09:39:40
Mexico,19 hours ago,In Search Of Nitrogen Generators,https://www.tradewheel.com/buyers/in-search-of-nitrogen-generators/869784/,"Hello, We are currently sourcing nitrogen generators. Please provide technical specifications, flow rates and models available. Kind Regards.",2025-09-03 09:39:40
Mauritius,19 hours ago,In Search Of Adhesive Sealants,https://www.tradewheel.com/buyers/in-search-of-adhesive-sealants/869783/,"Hello, We are sourcing high-performance adhesive sealants. The products must provide strong bonding, durability and weather resistance. Thank you.",2025-09-03 09:39:40
United Kingdom,19 hours ago,In Search Of Pdo Thread,https://www.tradewheel.com/buyers/in-search-of-pdo-thread/869781/,"Hello, We are sourcing medical-grade PDO threads for aesthetic procedures. The threads must be sterile, safe and FDA/CE certified. Kind Regards.",2025-09-03 09:39:40
China,20 hours ago,Immediate Purchase Of Seaweed,https://www.tradewheel.com/buyers/immediate-purchase-of-seaweed/869780/,"Hello, We are currently sourcing seaweed. The seaweed must be fresh, naturally dried and free from impurities. Kind Regards.",2025-09-03 09:39:40
USA,20 hours ago,In Search Of Lotion Pumps,https://www.tradewheel.com/buyers/in-search-of-lotion-pumps/869776/,"Good day, We would like to purchase lotion pumps. Kindly provide us with your product details and customization options. Thank you.",2025-09-03 09:39:40
Austria,20 hours ago,Need Mist Spray Pumps,https://www.tradewheel.com/buyers/need-mist-spray-pumps/869775/,"Hello, We are sourcing mist spray pumps for different products. The pumps must be leak-proof, durable and easy to use. Thank you.",2025-09-03 09:39:40
Malaysia,20 hours ago,In Search Of Beans Grinder,https://www.tradewheel.com/buyers/in-search-of-beans-grinder/869773/,"Dear Sir, I am interested in buying beans grinders. I am particularly looking for models with durable blades and easy cleaning options. Kind Regards.",2025-09-03 09:39:40
USA,20 hours ago,Immediate Purchase Of Coffee Tampers,https://www.tradewheel.com/buyers/immediate-purchase-of-coffee-tampers/869772/,"Good day, We are currently sourcing coffee tampers. The tampers must be ergonomic, durable and available in multiple sizes. Thank you.",2025-09-03 09:39:40
Pakistan,20 hours ago,Planning To Buy PCR Tyres,https://www.tradewheel.com/buyers/planning-to-buy-pcr-tyres/869771/,"Hi there, We are looking to purchase PCR tyres for distribution. The tyres must be durable, high-performance & designed for different road conditions.",2025-09-03 09:39:40
India,20 hours ago,Buying Led Solar Street Lights,https://www.tradewheel.com/buyers/buying-led-solar-street-lights/869769/,"Good day, We would like to purchase LED solar street lights. The lights must offer high brightness, energy efficiency and long battery life.",2025-09-03 09:39:40
Iraq,21 hours ago,Need Chrome Steel Bearings,https://www.tradewheel.com/buyers/need-chrome-steel-bearings/869753/,"Hello, We are currently sourcing chrome steel bearings. Please include your pricing terms, lead times and shipping options. Thank you.",2025-09-03 09:39:40
United Kingdom,21 hours ago,In Search Of Fringes,https://www.tradewheel.com/buyers/in-search-of-fringes/869752/,"Hi there, We are looking to purchase fringes. The fringes must be high-quality, durable and available in various designs. Kind Regards.",2025-09-03 09:39:40
USA,21 hours ago,Bulk Order For Lapel Pins,https://www.tradewheel.com/buyers/bulk-order-for-lapel-pins/869750/,"Hi there, We are currently sourcing custom lapel pins. The pins must be made of high-quality metal with precise finishing. Thank you.",2025-09-03 09:39:40
Portugal,21 hours ago,Buying Stainless Steel Utensils,https://www.tradewheel.com/buyers/buying-stainless-steel-utensils/869747/,"Hello, We are looking to purchase stainless steel utensils in bulk. Please provide us with your product details along with pricing. Thank you.",2025-09-03 09:39:40
Bangladesh,21 hours ago,Need Auto Lighting System,https://www.tradewheel.com/buyers/need-auto-lighting-system/869746/,"Hello, We are sourcing advanced auto lighting systems. The systems must include headlights, tail lights and interior lighting options.",2025-09-03 09:39:40
Malaysia,21 hours ago,Need Used Cooking Oil,https://www.tradewheel.com/buyers/need-used-cooking-oil/869745/,"Good day, We are currently sourcing used cooking oil (UCO). The oil must be well-filtered and free from excessive water or food residues.",2025-09-03 09:39:40
Ecuador,21 hours ago,In Search Of Herbal Extracts,https://www.tradewheel.com/buyers/in-search-of-herbal-extracts/869742/,"Greetings, We are currently sourcing herbal extracts. Please send us details of your extraction methods and purity levels. Kind Regards.",2025-09-03 09:39:40
Japan,21 hours ago,Need CNC Metal Cutting Machines,https://www.tradewheel.com/buyers/need-cnc-metal-cutting-machines/869741/,"Hello, We are sourcing CNC metal cutting machines. Please include details on warranty, installation and after-sales support. Kind Regards.",2025-09-03 09:39:40
USA,21 hours ago,Planning To Buy EN590,https://www.tradewheel.com/buyers/planning-to-buy-en590/869740/,"Greetings, We are interested in purchasing EN590 diesel fuel in bulk quantities. Please provide us with detailed specifications along with pricing. Thank you.",2025-09-03 09:39:40
South Korea,21 hours ago,In Search Of Golf Motorbikes,https://www.tradewheel.com/buyers/in-search-of-golf-motorbikes/869739/,"Hello, We are looking to purchase golf motorbikes. We are particularly looking for electric-powered models with strong battery life. Kind Regards.",2025-09-03 09:39:40
China,21 hours ago,Need Non Slip Mats,https://www.tradewheel.com/buyers/need-non-slip-mats/869738/,"Good day, We would like to purchase non-slip mats. Please provide us with your MOQ, pricing and delivery details. Thank you.",2025-09-03 09:39:40
USA,21 hours ago,Planning To Buy Barley,https://www.tradewheel.com/buyers/planning-to-buy-barley/869736/,"Hello, We are looking to purchase high-quality barley. We require both feed-grade and malting barley for different applications.",2025-09-03 09:39:40
Canada,22 hours ago,Planning To Buy Fishing Waders,https://www.tradewheel.com/buyers/planning-to-buy-fishing-waders/869727/,"Good day, We are looking to purchase fishing waders. The waders must be waterproof, durable and comfortable for long use. Kind Regards.",2025-09-03 09:39:40
USA,22 hours ago,In search of lobsters,https://www.tradewheel.com/buyers/in-search-of-lobsters/869726/,"Hello, We are currently sourcing frozen lobsters. The lobsters must be fresh, properly handled & meet international food safety standards.",2025-09-03 09:39:40
Japan,22 hours ago,In Search Of Gemstones,https://www.tradewheel.com/buyers/in-search-of-gemstones/869725/,"Hello, We are interested in sourcing natural gemstones. Please provide us information on available stock, pricing and packaging methods.",2025-09-03 09:39:40
Italy,22 hours ago,Bulk Order For Waterproof Connectors,https://www.tradewheel.com/buyers/bulk-order-for-waterproof-connectors/869724/,"Good day, We are currently sourcing waterproof connectors. Kindly provide product specifications, IP rating certifications and available sizes.",2025-09-03 09:39:40
Thailand,22 hours ago,In Search Of Cooler Bags,https://www.tradewheel.com/buyers/in-search-of-cooler-bags/869723/,"Hi there, We would like to purchase cooler bags. Kindly provide us with your product details along with customization options.",2025-09-03 09:39:40
Sweden,22 hours ago,In Search Of Slippers,https://www.tradewheel.com/buyers/in-search-of-slippers/869722/,"Hello, We are looking to purchase comfortable slippers. The slippers should be made from durable, lightweight and skin-friendly materials.",2025-09-03 09:39:40
Republic of Türkiye,22 hours ago,Require Regular Supply Of Chicken,https://www.tradewheel.com/buyers/require-regular-supply-of-chicken/869721/,"Hello, We are currently sourcing frozen chicken. The chicken must be processed under hygienic conditions and meet international food safety standards.",2025-09-03 09:39:40
Indonesia,22 hours ago,In Search Of Porcelain Plates,https://www.tradewheel.com/buyers/in-search-of-porcelain-plates/869720/,"Hi there, We are looking to purchase high-quality porcelain plates. We are particularly interested in different sizes and designs for household use.",2025-09-03 09:39:40
Ethiopia,22 hours ago,Seeking High Quality Inkjet Printers,https://www.tradewheel.com/buyers/seeking-high-quality-inkjet-printers/869719/,"Good day, We are sourcing high-performance inkjet printers. The printers must deliver clear, sharp, and fast printing quality. Kind Regards.",2025-09-03 09:39:40
Egypt,22 hours ago,In Search Of PET Flakes,https://www.tradewheel.com/buyers/in-search-of-pet-flakes/869717/,"Hello, We are interested in purchasing high-quality PET flakes. Kindly share your monthly capacity and available packaging options. Thank you.",2025-09-03 09:39:40
China,22 hours ago,Immediate Purchase Of Lift Tables,https://www.tradewheel.com/buyers/immediate-purchase-of-lift-tables/869715/,"Greetings, We are currently sourcing heavy-duty lift tables. Please share specifications, including maximum weight load and lifting height.",2025-09-03 09:39:40
Australia,22 hours ago,In Search Of Blankets,https://www.tradewheel.com/buyers/in-search-of-blankets/869714/,"Hello, We are looking for high-quality blankets. We are particularly interested in warm, lightweight and machine-washable designs.",2025-09-03 09:39:40
United Kingdom,1 day ago,Immediate purchase - Charger for European Market,https://www.tradewheel.com/buyers/immediate-purchase-charger-for-european-market/869663/,"We are importing mobile chargers for the European market. Suppliers meeting EU standards, please share quotations",2025-09-03 09:39:40
Israel,1 day ago,Buying Sugar for resale,https://www.tradewheel.com/buyers/buying-sugar-for-resale/869666/,Purchasing refined sugar in large volumes for resale. Suppliers with flexible contracts are invited to offer.,2025-09-03 09:39:40
Yemen,1 day ago,Searching for suppliers of Sugar,https://www.tradewheel.com/buyers/searching-for-suppliers-of-sugar/869671/,Currently seeking for reliable suppliers of refined sugar. Looking for bulk shipments at competitive market rates.,2025-09-03 09:39:40
Kuwait,1 day ago,Ready to buy Copper Cathodes,https://www.tradewheel.com/buyers/ready-to-buy-copper-cathodes/869673/,"We are ready to buy high-grade copper cathodes. Exporters with CIF offers, kindly reach out immediately",2025-09-03 09:39:40
Pakistan,1 day ago,Purchasing dumpling machine in bulk,https://www.tradewheel.com/buyers/purchasing-dumpling-machine-in-bulk/869674/,"We are buying commercial dumpling machines in for project use. Reliable manufacturers with after-sales support, kindly quote",2025-09-03 09:39:40
India,1 day ago,Need Laptops urgently,https://www.tradewheel.com/buyers/need-laptops-urgently/869675/,"Urgent requirement for branded laptops in large quantity. Suppliers with stock availability, please send quotations.",2025-09-03 09:39:40
Libya,1 day ago,Interested in buying Face Cream & Lotion,https://www.tradewheel.com/buyers/interested-in-buying-face-cream-lotion/869677/,"We would like to buy authentic Face Cream & Lotion products. Suppliers offering certified beauty items, kindly contact us.",2025-09-03 09:39:40
USA,1 day ago,Interested in Smart Google TV,https://www.tradewheel.com/buyers/interested-in-smart-google-tv/869678/,"Interested in sourcing Smart Google TVs with advanced features. Bulk purchase planned for distribution, please share details.",2025-09-03 09:39:40
United Kingdom,1 day ago,Looking for continuous supply of Prawn cage,https://www.tradewheel.com/buyers/looking-for-continuous-supply-of-prawn-cage/869680/,"We need a continuous supply of high-quality prawn cages. Suppliers capable of regular delivery, kindly reach out.",2025-09-03 09:39:40
USA,1 day ago,Ready to place order for Soybean Oil,https://www.tradewheel.com/buyers/ready-to-place-order-for-soybean-oil/869683/,"We are ready to place an order for refined soybean oil. Suppliers with certification and best rates, contact us today.",2025-09-03 09:39:40
USA,1 day ago,Immediate purchase – Night Light,https://www.tradewheel.com/buyers/immediate-purchase-night-light/869684/,"Looking to buy LED night lights in bulk immediately. Vendors with competitive prices, kindly respond at the earliest.",2025-09-03 09:39:40
India,1 day ago,Buying Durable Wooden Furniture for Children’s Everyday Use,https://www.tradewheel.com/buyers/buying-durable-wooden-furniture-for-childrens-everyday-use/869874/,We are evaluating kids’ bedroom wooden furniture sets. Please confirm certifications for child safety and polish type. Share designs and weight capacity details.,2025-09-03 09:39:40
USA,1 day ago,RFQ for concrete steel fibers,https://www.tradewheel.com/buyers/rfq-for-concrete-steel-fibers/869593/,"We are interested in purchasing concrete steel fibers with the following specifications: high-carbon steel, fiber length 60 mm, diameter 1.2 mm, tensile strength ≥1100 MPa, hooked-end surface, dosage 40 kg/m³, compliant with ASTM A820/EN 14889-1. Kin...",2025-09-03 09:39:40
Pakistan,1 day ago,Looking for mechanical counter meters from Chinese factory,https://www.tradewheel.com/buyers/looking-for-mechanical-counter-meters-from-chinese-factory/869592/,"I am looking for a Chinese factory for the manufacturing of mechanical counter meters We need 823,600 meters for this tender Kindly share your product details",2025-09-03 09:39:40
Australia,1 day ago,Bulk Order For Customized T-Shirts,https://www.tradewheel.com/buyers/bulk-order-for-customized-t-shirts/869577/,"Good day, We are interested in buying customized t-shirts. Please provide details on printing methods, embroidery options and available sizes.",2025-09-03 09:39:40
Iran,1 day ago,In search of pacific saury,https://www.tradewheel.com/buyers/in-search-of-pacific-saury/869576/,"Good day, We are interested in sourcing pacific saury. Please provide us with information on available sizes, grades and packaging methods. Thank you.",2025-09-03 09:39:40
Vietnam,1 day ago,Immediate purchase of tarpaulin covers,https://www.tradewheel.com/buyers/immediate-purchase-of-tarpaulin-covers/869575/,"Hello, We are interested in buying tarpaulin covers. The covers should be waterproof, UV-resistant and long-lasting. Thank you.",2025-09-03 09:39:40
China,1 day ago,In search of standing desks,https://www.tradewheel.com/buyers/in-search-of-standing-desks/869569/,"Good day, We are looking to purchase standing desks. The desks should feature height adjustability, ergonomic design and durable materials.",2025-09-03 09:39:40
Jamaica,1 day ago,Buying Spicy Rice Cakes,https://www.tradewheel.com/buyers/buying-spicy-rice-cakes/869568/,"Hi there, I would like to buy authentic spicy rice cakes. The product must be made with high-quality rice flour and traditional flavors. Kind Regards.",2025-09-03 09:39:40
Lithuania,1 day ago,Bulk Order For Walnuts,https://www.tradewheel.com/buyers/bulk-order-for-walnuts/869567/,"Good day, We are looking to purchase walnuts. Please provide us details on available grades, sizes and shipping options. Thank you.",2025-09-03 09:39:40
Romania,1 day ago,In search of brake pads,https://www.tradewheel.com/buyers/in-search-of-brake-pads/869565/,"Hello, We are sourcing premium brake pads for automobiles. Our requirements include high-performance pads with durability and low noise. Kind Regards.",2025-09-03 09:39:40
USA,1 day ago,In Search Of Anchor Bolts,https://www.tradewheel.com/buyers/in-search-of-anchor-bolts/869563/,"Good day, We are looking to purchase anchor bolts. The bolts must be strong, corrosion-resistant and meet international standards. Thank you.",2025-09-03 09:39:40
Brazil,1 day ago,In search of pet supplies,https://www.tradewheel.com/buyers/in-search-of-pet-supplies/869561/,"Good day, We are sourcing a wide range of pet supplies. Kindly provide us with product details along with available certifications. Thank you.",2025-09-03 09:39:40
USA,1 day ago,Sourcing LED bathroom mirrors,https://www.tradewheel.com/buyers/sourcing-led-bathroom-mirrors/869557/,"Good day, We are interested in LED bathroom mirrors. We are particularly looking for bathroom mirrors with anti-fog technology and energy-efficient lighting.",2025-09-03 09:39:40
South Africa,1 day ago,Requirement For Soybeans,https://www.tradewheel.com/buyers/requirement-for-soybeans/869552/,Hi we are looking for Soybeans we need 40 tons per month on a regular basis Please share your good prices Thank you,2025-09-03 09:39:40
Uruguay,1 day ago,Sourcing custom melamine cabinets,https://www.tradewheel.com/buyers/sourcing-custom-melamine-cabinets/869550/,"We are currently sourcing high-quality custom melamine cabinets for residential use. Kindly share details on customization capabilities including color options, textures & accessories.",2025-09-03 09:39:40
Brazil,1 day ago,Planning To Buy LED Screens,https://www.tradewheel.com/buyers/planning-to-buy-led-screens/869549/,"Hello, We are sourcing LED screens for advertising purposes. Could you share information on available sizes, pixel pitches and energy efficiency?",2025-09-03 09:39:40
Nigeria,1 day ago,Searching For Charcoal,https://www.tradewheel.com/buyers/searching-for-charcoal/869548/,Hi we need charcoal in Nigeria We have a requirement of 5000MT please share your good price with us Thank you,2025-09-03 09:39:40
China,1 day ago,In Search Of Bicycles,https://www.tradewheel.com/buyers/in-search-of-bicycles/869547/,"Hi there, We are interested in sourcing high-quality bicycles for distribution. Kindly share information on available prices, models and colors. Kind Regards.",2025-09-03 09:39:40
Australia,1 day ago,In Search Of Aluminum Profiles,https://www.tradewheel.com/buyers/in-search-of-aluminum-profiles/869545/,"Dear Sir, I am looking to buy aluminum profiles. The profiles must be available in different shapes & surface treatments like anodizing. Thank you.",2025-09-03 09:39:40
USA,1 day ago,Bulk Order For Packaging Tubes,https://www.tradewheel.com/buyers/bulk-order-for-packaging-tubes/869544/,We are interested in purchasing packaging tubes for cosmetics products. The packaging must ensure product safety and meet international standards.,2025-09-03 09:39:40
Tanzania,1 day ago,Need vacuum pump parts,https://www.tradewheel.com/buyers/need-vacuum-pump-parts/869543/,"Hello, We would like to buy vacuum pump parts. We are interested in different types of parts including seals, bearings and housings. Kind Regards.",2025-09-03 09:39:40
Italy,1 day ago,funky colors washable car seats,https://www.tradewheel.com/buyers/funky-colors-washable-car-seats/869758/,I want to buy car seats for kids in washable material. It should be in funky colors.,2025-09-03 09:39:40
Italy,2 days ago,Wish to buy Antimony Ingots,https://www.tradewheel.com/buyers/wish-to-buy-antimony-ingots/869546/,"Hey friend, We are searching for supplier of Antimony Ingots. Let us know the prices and details.",2025-09-03 09:39:40
South Africa,2 days ago,Looking for continuous supply of Fish Meal And bone Meal,https://www.tradewheel.com/buyers/looking-for-continuous-supply-of-fish-meal-and/869551/,"Hello, We are looking to purchase Fish Meal And bone Meal. Kindly send the price list and proper details.",2025-09-03 09:39:40
Republic of Türkiye,2 days ago,Intending to purchase Plastic Caps,https://www.tradewheel.com/buyers/intending-to-purchase-plastic-caps/869555/,"Hi friend, We are willing to purchase Plastic Caps. Quote prices and share the details.",2025-09-03 09:39:40
Bulgaria,2 days ago,Planning bulk order of Halters,https://www.tradewheel.com/buyers/planning-bulk-order-of-halters/869556/,We are planning a bulk order of halters for equestrian supplies. Manufacturers offering quality and variety are invited to provide quotations.,2025-09-03 09:39:40
Netherlands,2 days ago,Ready to place order for White Corn,https://www.tradewheel.com/buyers/ready-to-place-order-for-white-corn/869562/,"We are ready to place a confirmed order for white corn. Suppliers with fresh stock and wholesale pricing, please contact.",2025-09-03 09:39:40
USA,2 days ago,Immediate purchase – Palm Oil,https://www.tradewheel.com/buyers/immediate-purchase-palm-oil/869564/,"We are making an immediate purchase of palm oil in bulk. Reliable exporters with quality certifications, kindly share offers.",2025-09-03 09:39:40
Pakistan,2 days ago,Urgent requirement of Flour Mill Machine,https://www.tradewheel.com/buyers/urgent-requirement-of-flour-mill-machine/869566/,We have an urgent requirement of flour mill machines for commercial use. Suppliers with ready stock and competitive pricing are requested to quote.,2025-09-03 09:39:40
Mexico,2 days ago,Sourcing Power Bank for US Wholesale Buyers,https://www.tradewheel.com/buyers/sourcing-power-bank-for-us-wholesale-buyers/869570/,"We are sourcing power banks for US wholesale buyers. Suppliers with competitive bulk rates and fast shipping, please connect.",2025-09-03 09:39:40
Senegal,2 days ago,"Importing Cocoa Beans, Cocoa Mass, Cocoa Powder, Cocoa Butter for European Market",https://www.tradewheel.com/buyers/importing-cocoa-beans-cocoa-mass-cocoa-powder-cocoa/869571/,"We are importing cocoa beans, cocoa mass, cocoa powder, and cocoa butter for the European market. Suppliers with quality certifications and export experience are requested to quote.",2025-09-03 09:39:40
United Kingdom,2 days ago,Buying Copper Cathodes for resale,https://www.tradewheel.com/buyers/buying-copper-cathodes-for-resale/869573/,"We are buying copper cathodes in bulk for resale. Exporters with high purity standards and competitive rates, contact us.",2025-09-03 09:39:40
Philippines,2 days ago,Planning to buy beauty equipment,https://www.tradewheel.com/buyers/planning-to-buy-beauty-equipment/869574/,"Hello, I am looking to procure beauty equipment such as diode laser vascular removal machines. Please provide us with detailed specifications along with pricing.",2025-09-03 09:39:40
