country,date_posted,title,url,bdesc,crawl_time
Portugal,2 days ago,Searching for suppliers of Helmet,https://www.tradewheel.com/buyers/searching-for-suppliers-of-helmet/869585/,"We are searching for reliable suppliers of motorcycle helmets. Exporters with certified products, kindly share catalog and prices.",2025-09-03 09:39:40
Pakistan,2 days ago,Ready to buy Bike Gloves,https://www.tradewheel.com/buyers/ready-to-buy-bike-gloves/869588/,"We are ready to buy premium quality bike gloves in large quantity. Suppliers offering bulk rates and fast delivery, please connect.",2025-09-03 09:39:40
Slovenia,2 days ago,Want to source Fuel Pump,https://www.tradewheel.com/buyers/want-to-source-fuel-pump/869590/,We want to source fuel pumps for automotive applications. Reliable manufacturers and exporters are encouraged to contact us.,2025-09-03 09:39:40
Lebanon,2 days ago,Purchasing Condensed Milk in bulk,https://www.tradewheel.com/buyers/purchasing-condensed-milk-in-bulk/869599/,"We are purchasing condensed milk in bulk for our market. Interested suppliers, please share product details and quotations.",2025-09-03 09:39:40
Tanzania,2 days ago,Need Laptops urgently,https://www.tradewheel.com/buyers/need-laptops-urgently/869602/,"We need branded laptops urgently for corporate orders. Suppliers with immediate stock and good pricing, please respond.",2025-09-03 09:39:40
Indonesia,2 days ago,Would like to import Candlenut,https://www.tradewheel.com/buyers/would-like-to-import-candlenut/869603/,"We would like to import candlenuts in large volumes. Exporters with competitive CIF offers, kindly share quotations.",2025-09-03 09:39:40
South Korea,2 days ago,Would like to buy Electric Bicycle,https://www.tradewheel.com/buyers/would-like-to-buy-electric-bicycle/869604/,We would like to buy electric bicycles for commercial supply. Suppliers with latest models and bulk availability may contact.,2025-09-03 09:39:40
Australia,2 days ago,Interested in Perfume Oil,https://www.tradewheel.com/buyers/interested-in-perfume-oil/869605/,We are interested in purchasing perfume oil in large quantities. Exporters offering quality and competitive rates are invited.,2025-09-03 09:39:40
Australia,2 days ago,Looking for Vape,https://www.tradewheel.com/buyers/looking-for-vape/869611/,"Currently looking for high-quality vape products for wholesale. Manufacturers and exporters with ready stock, please connect.",2025-09-03 09:39:40
United Kingdom,2 days ago,Looking for continuous supply of Nuts,https://www.tradewheel.com/buyers/looking-for-continuous-supply-of-nuts/869613/,We are looking for continuous supply of mixed edible nuts. Reliable suppliers offering wholesale rates are requested to quote.,2025-09-03 09:39:40
United Arab Emirates,2 days ago,Rush order for Green Cardamom – Contact ASAP,https://www.tradewheel.com/buyers/rush-order-for-green-cardamom-contact-asap/869614/,"A rush order is required for green cardamom in bulk quantities. Suppliers with quick shipping options, kindly contact us ASAP.",2025-09-03 09:39:40
Pakistan,2 days ago,Planning bulk order of Shoes,https://www.tradewheel.com/buyers/planning-bulk-order-of-shoes/869618/,We are planning a bulk order of shoes for our retail distribution. Suppliers with variety and competitive prices are welcome to quote.,2025-09-03 09:39:40
India,2 days ago,Ready to place order for Headlight,https://www.tradewheel.com/buyers/ready-to-place-order-for-headlight/869629/,We are ready to place a confirmed order for high-quality headlights. Interested manufacturers and exporters are invited to respond.,2025-09-03 09:39:40
Netherlands,2 days ago,Immediate purchase – Jet fuel,https://www.tradewheel.com/buyers/immediate-purchase-jet-fuel/869633/,"We are looking to make an immediate purchase of Jet Fuel. Interested suppliers with competitive pricing, please share offers.",2025-09-03 09:39:40
India,2 days ago,Urgent requirement of Motorcycle Tires,https://www.tradewheel.com/buyers/urgent-requirement-of-motorcycle-tires/869634/,We urgently need premium quality motorcycle tires for immediate supply. Suppliers with stock on hand are requested to contact us quickly.,2025-09-03 09:39:40
Russia,2 days ago,Urgent requirement of Safety mesh rope nets,https://www.tradewheel.com/buyers/urgent-requirement-of-safety-mesh-rope-nets/869635/,"Urgent requirement for industrial safety mesh rope nets. Suppliers with immediate availability, kindly provide details.",2025-09-03 09:39:40
Sri Lanka,2 days ago,Export Buyer Needs Hair spray products – Long-Term Supply Contract,https://www.tradewheel.com/buyers/export-buyer-needs-hair-spray-products-long-term/869637/,"Export buyer requires hair spray products under long-term supply contract. Suppliers with consistent quality, please reach out.",2025-09-03 09:39:40
Poland,2 days ago,Sourcing Polypropylene Staple Fiber for US Wholesale Buyers,https://www.tradewheel.com/buyers/sourcing-polypropylene-staple-fiber-for-us-wholesale-buyers/869638/,"Sourcing polypropylene staple fiber for US wholesale buyers. Reliable exporters, kindly share specifications and rates.",2025-09-03 09:39:40
South Africa,2 days ago,Importing Gel Polish and nail products for European Market,https://www.tradewheel.com/buyers/importing-gel-polish-and-nail-products-for-european/869639/,Importing gel polish and nail care products for EU market. Exporters with compliance certification are invited to offer.,2025-09-03 09:39:40
Slovenia,2 days ago,Buying OXYGEN CONCENTRATORS for resale,https://www.tradewheel.com/buyers/buying-oxygen-concentrators-for-resale/869640/,"Buying oxygen concentrators in large quantity for resale. Suppliers with certifications, please contact immediately.",2025-09-03 09:39:40
Nigeria,2 days ago,Require school furniture for wholesale,https://www.tradewheel.com/buyers/require-school-furniture-for-wholesale/869641/,"Require wholesale supply of durable school furniture. Manufacturers offering bulk deals, kindly get in touch.",2025-09-03 09:39:40
Bangladesh,2 days ago,Searching for suppliers of En590,https://www.tradewheel.com/buyers/searching-for-suppliers-of-en590/869644/,"Searching for reliable suppliers of EN590 diesel fuel. Exporters with international supply capacity, please connect.",2025-09-03 09:39:40
Sri Lanka,2 days ago,Ready to buy Disposable mask,https://www.tradewheel.com/buyers/ready-to-buy-disposable-mask/869645/,"Ready to buy disposable face masks for wholesale. Suppliers meeting quality certifications, kindly share prices.",2025-09-03 09:39:40
South Africa,2 days ago,Want to source Fresh Lemon,https://www.tradewheel.com/buyers/want-to-source-fresh-lemon/869646/,"We want to source fresh lemons in large volume. Exporters with high-quality produce, please contact us.",2025-09-03 09:39:40
USA,2 days ago,Purchasing EN590 in bulk,https://www.tradewheel.com/buyers/purchasing-en590-in-bulk/869648/,"We are purchasing EN590 diesel fuel in bulk quantities. Suppliers with CIF/FOB offers, kindly send best quotes.",2025-09-03 09:39:40
India,2 days ago,Need fertilizer urgently,https://www.tradewheel.com/buyers/need-fertilizer-urgently/869649/,Urgent requirement for agricultural fertilizers in bulk. Suppliers with ready stock are requested to contact us.,2025-09-03 09:39:40
Pakistan,2 days ago,Would like to import Wall Clocks,https://www.tradewheel.com/buyers/would-like-to-import-wall-clocks/869650/,"We would like to import wall clocks in assorted designs. Export-ready manufacturers, kindly provide catalog and pricing.",2025-09-03 09:39:40
Nigeria,2 days ago,Would like to buy ALUMINUM INGOT,https://www.tradewheel.com/buyers/would-like-to-buy-aluminum-ingot/869651/,"We would like to buy aluminium ingots for industrial use. Suppliers offering A7 grade, please share quotations.",2025-09-03 09:39:40
Tanzania,2 days ago,Interested in Copper cathode,https://www.tradewheel.com/buyers/interested-in-copper-cathode/869653/,"Interested in purchasing high-grade copper cathodes. Exporters with quality assurance, kindly connect.",2025-09-03 09:39:40
Nicaragua,2 days ago,Looking for dust collector,https://www.tradewheel.com/buyers/looking-for-dust-collector/869654/,"Looking for industrial-grade dust collectors. Suppliers offering durable systems, please contact us.",2025-09-03 09:39:40
Bangladesh,2 days ago,Looking for continuous supply of soybean oil,https://www.tradewheel.com/buyers/looking-for-continuous-supply-of-soybean-oil/869655/,"We are looking for continuous supply of refined soybean oil. Reliable exporters, kindly send specifications and price.",2025-09-03 09:39:40
Iran,2 days ago,Rush order for Sunflower and soybean Oil – Contact ASAP,https://www.tradewheel.com/buyers/rush-order-for-sunflower-and-soybean-oil/869656/,"We require a rush supply of sunflower and soybean oil. Exporters with availability, please contact us immediately.",2025-09-03 09:39:40
Mexico,2 days ago,Planning bulk order of water pump,https://www.tradewheel.com/buyers/planning-bulk-order-of-water-pump/869657/,"We are planning a bulk order of water pumps. Reliable suppliers with competitive prices, kindly respond.",2025-09-03 09:39:40
France,2 days ago,Ready to place order for Analyzer,https://www.tradewheel.com/buyers/ready-to-place-order-for-analyzer/869658/,We are ready to place an order for medical analyzers. Certified manufacturers are invited to share product details.,2025-09-03 09:39:40
Pakistan,2 days ago,Immediate purchase – laptops,https://www.tradewheel.com/buyers/immediate-purchase-laptops/869659/,"Immediate requirement of laptops for wholesale distribution. Interested suppliers with stock, please contact urgently.",2025-09-03 09:39:40
South Africa,2 days ago,Urgent requirement of goat,https://www.tradewheel.com/buyers/urgent-requirement-of-goat/869660/,"Rush order for live goats for meat and breeding. Suppliers with export capability, kindly send offers.",2025-09-03 09:39:40
Nepal,4 days ago,Inquiry for baby car seat,https://www.tradewheel.com/buyers/inquiry-for-baby-car-seat/869757/,We are looking for a factory who produces baby car seats in China.,2025-09-03 09:39:40
