country,date_posted,title,url,bdesc,crawl_time
United Kingdom,31 minutes ago,Prices For Soybean and Corn,https://www.tradewheel.com/buyers/prices-for-soybean-and-corn/902542/,Hello We are looking for Soybean and Corn in UK We need about 50MT both Soybean and Corn Kindly share your complete company profile Thank you,2025-11-19 13:48:48
USA,18 hours ago,Need prices for charger,https://www.tradewheel.com/buyers/need-prices-for-charger/902386/,"I am looking for the 100 pcs of chargers that have 3 different ends on one cord. Type C, Iphone , things like that. I am a resaler trying to get a business up and running so looking for just about anything",2025-11-19 13:48:48
Italy,18 hours ago,"Need to Purchase Makeup brushes, Wholesale in bulk",https://www.tradewheel.com/buyers/need-to-purchase-makeup-brushes-wholesale-in-bulk/902383/,"Hi I am looking to purchase high-quality vegan makeup brushes, eyeshadow palettes, and beauty sponges. I am also interested in exploring custom-branded options and reviewing your available models to select the most suitable products for my brand....",2025-11-19 13:48:48
Australia,19 hours ago,Importing bottle – Need quotes,https://www.tradewheel.com/buyers/importing-bottle-need-quotes/902374/,"Good day, We would like to purchase water bottles for school and offices use. Hoping to connect soon and explore cooperation opportunities.",2025-11-19 13:48:48
Singapore,19 hours ago,Procuring Float Glass for Building and Interior Projects,https://www.tradewheel.com/buyers/procuring-float-glass-for-building-and-interior-projects/902372/,I want to procure low iron float glass. Thickness: 10 mm Size: 1500 mm x 600 mm Quantity: 4 sheets Delivery to: Singapore Please provide FOB/CIF price and lead time,2025-11-19 13:48:48
China,19 hours ago,Buying sugar for export.,https://www.tradewheel.com/buyers/buying-sugar-for-export/902371/,"Greetings, We require bulk quantities of sugar at wholesale price. Kindly share your catalog, minimum order quantity along with delivery timeline.",2025-11-19 13:48:48
China,19 hours ago,Sourcing Hair Treatment Products for Salon and Retail Use,https://www.tradewheel.com/buyers/sourcing-hair-treatment-products-for-salon-and-retail/902370/,"We are purchasing hair treatment products for salons. Types: oils, serums, masks Packaging: bottles, tubes MOQ: 500 units per SKU",2025-11-19 13:48:48
China,19 hours ago,Buying Dump Truck for Heavy-Duty Transport and Logistics,https://www.tradewheel.com/buyers/buying-dump-truck-for-heavy-duty-transport-and-logistics/902369/,"We need 2 units of dump trucks, heavy-duty, suitable for construction sites. Please send full specifications and quotation for review.",2025-11-19 13:48:48
USA,19 hours ago,Procuring Car Radio for Automotive Aftermarket Supply,https://www.tradewheel.com/buyers/procuring-car-radio-for-automotive-aftermarket-supply/902368/,"I’m looking for car radios, 50 pcs, Bluetooth-enabled, FM/AM, suitable for standard dashboards. Please respond with your quotation and lead time.",2025-11-19 13:48:48
United Kingdom,19 hours ago,Need Korean Skincare for Cosmetic Retail Distribution,https://www.tradewheel.com/buyers/need-korean-skincare-for-cosmetic-retail-distribution/902367/,"I’m searching Korean skincare products, 500 units, hydrating and anti-aging formulations, ready for retail packaging. Awaiting your commercial offer for evaluation.",2025-11-19 13:48:48
Zambia,19 hours ago,Buying Electric Heaters for Seasonal Stock and Retail Supply,https://www.tradewheel.com/buyers/buying-electric-heaters-for-seasonal-stock-and-retail/902366/,"I want to source electric heaters in bulk. Features: overheat protection, thermostat Packaging: retail box or bulk Delivery: FOB/CIF",2025-11-19 13:48:48
South Africa,19 hours ago,Importing Construction Machinery Parts for Equipment Maintenance,https://www.tradewheel.com/buyers/importing-construction-machinery-parts-for-equipment-maintenance/902364/,"We need 150 units of construction machinery parts, precision-made and durable, suitable for repair and assembly. Awaiting your commercial offer for evaluation.",2025-11-19 13:48:48
Dominican Republic,19 hours ago,Procuring Dining Table for Home and Office Furniture Supply,https://www.tradewheel.com/buyers/procuring-dining-table-for-home-and-office-furniture/902363/,"We require dining tables for wholesale furniture supply. Material: solid wood, engineered wood, glass top Design: modern, classic Size: 120–200 cm length MOQ: 50 pcs",2025-11-19 13:48:48
France,19 hours ago,Sourcing CPUs for Computer Assembly and IT Upgrades,https://www.tradewheel.com/buyers/sourcing-cpus-for-computer-assembly-and-it-upgrades/902362/,"We are purchasing CPUs for computer assembly. Type: Intel i5/i7, AMD Ryzen 5/7 Clock speed: 2.5–4.5 GHz Warranty: 1 year MOQ: 50 pcs",2025-11-19 13:48:48
Albania,19 hours ago,Looking to partner with baby food supplier,https://www.tradewheel.com/buyers/looking-to-partner-with-baby-food-supplier/902361/,"Good day, We are currently sourcing baby food. The products must be made from high-quality ingredients with no harmful additives.",2025-11-19 13:48:48
Hong Kong,19 hours ago,Buying Steel Round Bars for Construction and Fabrication Projects,https://www.tradewheel.com/buyers/buying-steel-round-bars-for-construction-and-fabrication/902360/,"I am looking for suppliers of steel round bars. Surface: hot-rolled, cold-rolled Grade: ASTM A36, AISI 304 Packaging: bundled or palletized",2025-11-19 13:48:48
Germany,19 hours ago,Honey needed for retain chain supply,https://www.tradewheel.com/buyers/honey-needed-for-retain-chain-supply/902359/,"Good day, We are interested in buying honey. Could you provide us with availability along with pricing? Kind Regards.",2025-11-19 13:48:48
Hong Kong,19 hours ago,Required dried seafood in bulk quantities,https://www.tradewheel.com/buyers/required-dried-seafood-in-bulk-quantities/902357/,"Hello, We want to purchase dried seafood suitable for retail sale and food processing. You can reach me through email for quick communication.",2025-11-19 13:48:48
Hong Kong,19 hours ago,Bulk purchase inquiry for plastic cups,https://www.tradewheel.com/buyers/bulk-purchase-inquiry-for-plastic-cups/902356/,"Hello, We are currently seeking plastic cups. We prefer suppliers offering custom printing and eco-friendly options. Kind Regards.",2025-11-19 13:48:48
Pakistan,19 hours ago,Need cookware sets for distribution,https://www.tradewheel.com/buyers/need-cookware-sets-for-distribution/902355/,"Greetings, We are interested in buying cookware sets. The sets must include durable materials, even heat distribution & stainless-steel surfaces.",2025-11-19 13:48:48
India,1 day ago,Importing Car Refrigerators – Need Quotes,https://www.tradewheel.com/buyers/importing-car-refrigerators-need-quotes/902134/,"Hello, We would like to purchase Car Refrigerators. We require units with fast cooling, low power consumption and stable performance.",2025-11-19 13:48:48
Japan,1 day ago,Buying Telecentric Lens for High-Accuracy Industrial Imaging Projects,https://www.tradewheel.com/buyers/buying-telecentric-lens-for-high-accuracy-industrial-imaging-projects/902133/,We require telecentric lens options with low distortion and adjustable working distance for precision measurement tasks. Please respond with your quotation and lead time.,2025-11-19 13:48:48
